<?xml version="1.0"?>
<!--
Click nbfs://nbhost/SystemFileSystem/Templates/Licenses/license-default.txt to change this license
Click nbfs://nbhost/SystemFileSystem/Templates/XML/XmlSchema.xsd to edit this template
-->

<xs:schema version="1.0"
           xmlns:xs="http://www.w3.org/2001/XMLSchema">
    <xs:element name="library">
        <xs:complexType>
            <xs:sequence>
                <xs:element name="book" maxOccurs="unbounded">
                    <xs:complexType>
                        <xs:sequence>
                            <xs:element name="title" type="xs:string"/>
                            <xs:element name="author" type="xs:string"/>
                            <xs:element name="year" type="xs:positiveInteger"/>
                            <xs:element name="price" type="xs:decimal"/>
                            <xs:element name="category" type="xs:string"/>
                            <xs:element name="amount" type="xs:positiveInteger"/>
                            <xs:element name="available" type="xs:nonNegativeInteger"/>
                        </xs:sequence>
                        <xs:attribute name="id" type="xs:positiveInteger" use="required"/>
                    </xs:complexType>
                </xs:element>
            </xs:sequence>
        </xs:complexType>
    </xs:element>

</xs:schema>
